{
  "schemaVersion": "1.8",
  "type": "video",
  "settings": {
    "width": 1920,
    "height": 1080,
    "fps": 30,
    "background": "#10131C",
    "reducedMotion": true
  },
  "generator": {
    "extension": "0.1.0",
    "cli": "0.0.0"
  },
  "scenes": [
    {
      "id": "scene-001",
      "component": "split-screen",
      "durationFrames": 120,
      "content": {
        "slots": {
          "left": [
            {
              "type": "paragraph",
              "inlines": [
                {
                  "type": "text",
                  "text": "Left"
                }
              ]
            }
          ],
          "right": [
            {
              "type": "paragraph",
              "inlines": [
                {
                  "type": "text",
                  "text": "Right"
                }
              ]
            }
          ]
        }
      },
      "source": {
        "file": "index.qmd",
        "line": 5
      },
      "animation": {
        "name": "fade-in"
      },
      "media": [
        {
          "type": "video",
          "src": "assets/left.mp4",
          "placement": "region",
          "region": "left",
          "fit": "cover",
          "sourceStartFrames": 0,
          "sourceEndFrames": 60,
          "audio": "keep",
          "loop": false,
          "freeze": true,
          "playbackRate": 1,
          "alt": "",
          "volume": 0.5
        },
        {
          "type": "video",
          "src": "assets/right.mp4",
          "placement": "region",
          "region": "right",
          "fit": "contain",
          "sourceStartFrames": 30,
          "sourceEndFrames": 90,
          "audio": "mute",
          "loop": false,
          "freeze": true,
          "playbackRate": 1,
          "alt": ""
        }
      ]
    },
    {
      "id": "scene-002",
      "component": "title",
      "durationFrames": 120,
      "transition": {
        "name": "fade",
        "durationFrames": 30
      },
      "content": {
        "slots": {
          "default": [
            {
              "type": "paragraph",
              "inlines": [
                {
                  "type": "text",
                  "text": "Parallel work"
                }
              ]
            }
          ]
        }
      },
      "source": {
        "file": "index.qmd",
        "line": 11
      }
    },
    {
      "id": "scene-003",
      "component": "chart",
      "durationFrames": 120,
      "transition": {
        "name": "fade",
        "durationFrames": 30
      },
      "content": {
        "slots": {}
      },
      "props": {
        "type": "bar",
        "data": "data/memory.csv",
        "x": "gpu",
        "y": "bandwidth",
        "unit": "GB/s",
        "title": "Memory bandwidth"
      },
      "tables": {
        "data": {
          "columns": ["gpu", "bandwidth"],
          "rows": [
            ["A", "900"],
            ["B", "1555"],
            ["C", "2039"]
          ]
        }
      },
      "source": {
        "file": "index.qmd",
        "line": 17
      }
    },
    {
      "id": "scene-004",
      "component": "statistic",
      "durationFrames": 120,
      "transition": {
        "name": "fade",
        "durationFrames": 30
      },
      "content": {
        "slots": {
          "label": [
            {
              "type": "paragraph",
              "inlines": [
                {
                  "type": "text",
                  "text": "Bytes of memory on the card"
                }
              ]
            }
          ]
        }
      },
      "props": {
        "value": 1000000000,
        "decimals": 0,
        "unit": "bytes"
      },
      "source": {
        "file": "index.qmd",
        "line": 23
      }
    }
  ],
  "timeline": {
    "durationFrames": 390,
    "scenes": [
      {
        "id": "scene-001",
        "startFrame": 0
      },
      {
        "id": "scene-002",
        "startFrame": 90
      },
      {
        "id": "scene-003",
        "startFrame": 180
      },
      {
        "id": "scene-004",
        "startFrame": 270
      }
    ]
  }
}
